{
  "$schema": "https://json-schema.org/draft/2020-12/schema",
  "$id": "urn:sports-research:decision-packet:v1",
  "title": "Sports Research Decision Packet v1",
  "type": "object",
  "additionalProperties": false,
  "required": ["schema_version", "request", "decision_snapshot", "candidate_universe", "source_packet", "live_state", "prediction", "forecast_distributions", "linked_market_relations", "uncertainty_components", "price_snapshot"],
  "properties": {
    "schema_version": { "const": "SPORTS_DECISION_PACKET_V1" },
    "request": { "$ref": "#/$defs/request" },
    "decision_snapshot": { "$ref": "#/$defs/decisionSnapshot" },
    "candidate_universe": { "anyOf": [{ "$ref": "#/$defs/candidateUniverse" }, { "type": "null" }] },
    "source_packet": { "anyOf": [{ "$ref": "#/$defs/sourcePacket" }, { "type": "null" }] },
    "live_state": { "type": ["object", "null"] },
    "prediction": { "anyOf": [{ "$ref": "#/$defs/prediction" }, { "type": "null" }] },
    "forecast_distributions": { "type": "array", "items": { "$ref": "#/$defs/distribution" } },
    "linked_market_relations": { "type": "array", "items": { "type": "object" } },
    "uncertainty_components": { "type": "array", "items": { "$ref": "#/$defs/uncertainty" } },
    "price_snapshot": { "type": ["object", "null"] }
  },
  "allOf": [
    {
      "if": {
        "type": "object",
        "properties": {
          "decision_snapshot": {
            "type": "object",
            "properties": { "decision": { "enum": ["PASS", "WATCH"] } },
            "required": ["decision"]
          }
        }
      },
      "then": {
        "type": "object",
        "properties": {
          "candidate_universe": { "type": "null" },
          "source_packet": { "type": "null" },
          "live_state": { "type": "null" },
          "prediction": { "type": "null" },
          "forecast_distributions": { "type": "array", "maxItems": 0 },
          "linked_market_relations": { "type": "array", "maxItems": 0 },
          "uncertainty_components": { "type": "array", "maxItems": 0 },
          "price_snapshot": { "type": "null" }
        }
      }
    },
    {
      "if": {
        "type": "object",
        "properties": {
          "decision_snapshot": {
            "type": "object",
            "properties": { "decision": { "const": "ISSUE" } },
            "required": ["decision"]
          }
        }
      },
      "then": {
        "type": "object",
        "properties": {
          "candidate_universe": { "$ref": "#/$defs/candidateUniverse" },
          "source_packet": { "$ref": "#/$defs/sourcePacket" },
          "prediction": { "$ref": "#/$defs/prediction" },
          "forecast_distributions": { "type": "array", "minItems": 1 },
          "uncertainty_components": { "type": "array", "minItems": 5 }
        }
      }
    }
  ],
  "$defs": {
    "utc": { "type": "string", "pattern": "^\\d{4}-\\d{2}-\\d{2}T\\d{2}:\\d{2}:\\d{2}(?:\\.\\d{3})?Z$" },
    "id": { "type": "string", "minLength": 1, "maxLength": 200 },
    "request": {
      "type": "object",
      "required": ["request_id", "primary_question_id", "primary_question_text", "raw_request_text", "contract_status", "request_timestamp_utc", "forecast_series_id", "created_by"],
      "properties": {
        "request_id": { "$ref": "#/$defs/id" },
        "primary_question_id": { "$ref": "#/$defs/id" },
        "primary_question_text": { "type": "string", "minLength": 1 },
        "raw_request_text": { "type": "string", "minLength": 1 },
        "contract_status": { "enum": ["RESOLVED", "UNRESOLVED"] },
        "request_timestamp_utc": { "$ref": "#/$defs/utc" },
        "forecast_series_id": { "$ref": "#/$defs/id" },
        "event_id": { "type": ["string", "null"] },
        "sport_family": { "type": ["string", "null"] },
        "competition_id": { "type": ["string", "null"] },
        "season_id": { "type": ["string", "null"] },
        "event_name": { "type": ["string", "null"] },
        "venue": { "type": ["string", "null"] },
        "event_start_utc": { "anyOf": [{ "$ref": "#/$defs/utc" }, { "type": "null" }] },
        "ruleset_id": { "type": ["string", "null"] },
        "market_id": { "type": ["string", "null"] },
        "market_family": { "type": ["string", "null"] },
        "selection": { "type": ["string", "null"] },
        "line": { "type": ["number", "string", "null"] },
        "settlement_convention_id": { "type": ["string", "null"] },
        "analysis_mode": { "enum": ["RESEARCH_ONLY", "PRICE_ENABLED", null] },
        "forecast_state": { "enum": ["PREGAME_PROJECTED", "PREGAME_CONFIRMED", "LIVE", null] },
        "state_bucket_id": { "type": ["string", "null"] },
        "horizon_bucket_id": { "type": ["string", "null"] },
        "selection_mode": { "enum": ["USER_SUPPLIED", "FIXED_UNIVERSE", "MODEL_SELECTED", null] },
        "candidate_universe_id": { "type": ["string", "null"] },
        "selection_policy_version": { "type": ["string", "null"] },
        "user_cancelled": { "type": "boolean" },
        "created_by": { "$ref": "#/$defs/id" }
      },
      "additionalProperties": false
    },
    "decisionSnapshot": {
      "type": "object",
      "required": ["snapshot_id", "request_id", "forecast_series_id", "snapshot_sequence", "frozen_at_utc", "data_cutoff_utc", "decision", "price_evaluation_status", "data_quality_grade", "missing_prerequisites", "primary_failed_gate", "gate_failure_evidence", "snapshot_hash", "created_by"],
      "properties": {
        "snapshot_id": { "$ref": "#/$defs/id" },
        "request_id": { "$ref": "#/$defs/id" },
        "forecast_series_id": { "$ref": "#/$defs/id" },
        "parent_snapshot_id": { "type": ["string", "null"] },
        "snapshot_sequence": { "type": "integer", "minimum": 1 },
        "frozen_at_utc": { "$ref": "#/$defs/utc" },
        "data_cutoff_utc": { "$ref": "#/$defs/utc" },
        "decision": { "enum": ["ISSUE", "WATCH", "PASS"] },
        "pass_reason": { "type": ["string", "null"] },
        "watch_reason": { "type": ["string", "null"] },
        "watch_expires_utc": { "anyOf": [{ "$ref": "#/$defs/utc" }, { "type": "null" }] },
        "price_evaluation_status": { "enum": ["NOT_REQUESTED", "PENDING", "VALUE", "NO_VALUE", "PRICE_UNAVAILABLE"] },
        "data_quality_grade": { "enum": ["A", "B", "C", "D"] },
        "source_packet_id": { "type": ["string", "null"] },
        "candidate_universe_id": { "type": ["string", "null"] },
        "missing_prerequisites": { "type": "array", "items": { "type": "string" } },
        "primary_failed_gate": { "type": ["string", "null"] },
        "gate_failure_evidence": { "type": "array", "items": { "$ref": "#/$defs/gateFailureEvidence" } },
        "research_note": { "type": ["string", "null"] },
        "snapshot_hash": { "type": "string", "pattern": "^[a-f0-9]{64}$" },
        "created_by": { "$ref": "#/$defs/id" }
      },
      "additionalProperties": false
    },
    "gateFailureEvidence": {
      "type": "object",
      "additionalProperties": false,
      "required": ["gate_id", "code", "detail", "evidence_refs"],
      "properties": {
        "gate_id": { "$ref": "#/$defs/id" },
        "code": { "$ref": "#/$defs/id" },
        "detail": { "type": "string", "minLength": 1 },
        "evidence_refs": { "type": "array", "minItems": 1, "items": { "$ref": "#/$defs/id" } },
        "artifact_hash": { "type": "string", "pattern": "^[a-f0-9]{64}$" }
      }
    },
    "candidateUniverse": {
      "type": "object",
      "additionalProperties": true,
      "required": ["candidate_universe_id", "request_id", "primary_question_id", "universe_definition_version", "selection_mode", "selection_policy_version", "known_at_utc", "frozen_at_utc", "enumeration_manifest_hash", "candidate_count", "universe_hash", "candidates"],
      "properties": {
        "candidate_universe_id": { "$ref": "#/$defs/id" }, "request_id": { "$ref": "#/$defs/id" },
        "primary_question_id": { "$ref": "#/$defs/id" }, "universe_definition_version": { "$ref": "#/$defs/id" },
        "selection_mode": { "$ref": "#/$defs/id" }, "selection_policy_version": { "$ref": "#/$defs/id" },
        "known_at_utc": { "$ref": "#/$defs/utc" }, "frozen_at_utc": { "$ref": "#/$defs/utc" },
        "enumeration_manifest_hash": { "type": "string" }, "candidate_count": { "type": "integer", "minimum": 1 },
        "universe_hash": { "type": "string" }, "candidates": { "type": "array", "minItems": 1 }
      }
    },
    "sourcePacket": {
      "type": "object",
      "additionalProperties": true,
      "required": ["source_packet_id", "request_id", "snapshot_id", "source_map_id", "frozen_at_utc", "observations", "source_packet_hash"],
      "properties": {
        "source_packet_id": { "$ref": "#/$defs/id" }, "request_id": { "$ref": "#/$defs/id" },
        "snapshot_id": { "$ref": "#/$defs/id" }, "source_map_id": { "$ref": "#/$defs/id" },
        "frozen_at_utc": { "$ref": "#/$defs/utc" }, "observations": { "type": "array", "minItems": 1 },
        "source_packet_hash": { "type": "string" }
      }
    },
    "prediction": {
      "type": "object",
      "additionalProperties": true,
      "required": ["prediction_id", "snapshot_id", "selected_candidate_id", "forecast_distribution_id", "model_id", "model_version", "coverage_id", "decision_probability"],
      "properties": {
        "prediction_id": { "$ref": "#/$defs/id" }, "snapshot_id": { "$ref": "#/$defs/id" },
        "selected_candidate_id": { "$ref": "#/$defs/id" }, "forecast_distribution_id": { "$ref": "#/$defs/id" },
        "model_id": { "$ref": "#/$defs/id" }, "model_version": { "$ref": "#/$defs/id" },
        "coverage_id": { "$ref": "#/$defs/id" }, "decision_probability": { "type": "number", "minimum": 0, "maximum": 1 }
      }
    },
    "distribution": {
      "type": "object",
      "additionalProperties": true,
      "required": ["forecast_distribution_id", "market_outcome_space_id", "calibration_evidence_id", "frozen_at_utc", "states", "distribution_hash"],
      "properties": {
        "forecast_distribution_id": { "$ref": "#/$defs/id" }, "market_outcome_space_id": { "$ref": "#/$defs/id" },
        "calibration_evidence_id": { "$ref": "#/$defs/id" }, "frozen_at_utc": { "$ref": "#/$defs/utc" },
        "states": { "type": "array", "minItems": 2 }, "distribution_hash": { "type": "string" }
      }
    },
    "uncertainty": {
      "type": "object",
      "additionalProperties": true,
      "required": ["uncertainty_component_id", "uncertainty_set_id", "prediction_id", "uncertainty_type", "uncertainty_status", "estimand", "method_version", "evidence_artifact_hash", "material", "decision_robust"],
      "properties": {
        "uncertainty_component_id": { "$ref": "#/$defs/id" }, "uncertainty_set_id": { "$ref": "#/$defs/id" },
        "prediction_id": { "$ref": "#/$defs/id" }, "uncertainty_type": { "$ref": "#/$defs/id" },
        "uncertainty_status": { "$ref": "#/$defs/id" }, "estimand": { "$ref": "#/$defs/id" },
        "method_version": { "$ref": "#/$defs/id" }, "evidence_artifact_hash": { "type": "string" },
        "material": { "type": "boolean" }, "decision_robust": { "type": "boolean" }
      }
    }
  }
}
